{
  "schemaVersion": "3.0",
  "launchId": "integrated-robotic-handling-v3",
  "launchDigest": "0046d640d935e28619a61a15939d661a57ea72023201c73047f03342baff6cb8",
  "promptSha256": "e06bf42926526485f04b2b880f46052a16a59aeefce61d17f1098e5e911d0a1c",
  "launchJsonSha256": "57576c8f59ea9619a6ddcacbb27ecb2a544a6387c4f2e179370cd2f6348f5588",
  "pageSha256": "46d157759226c8f24375078ce3f92dba587e976bb36dc1ef6dfb1d85051bb814",
  "canonicalBaseUrl": "https://naoyamd.github.io/rotorbench",
  "canonicalOrigin": "https://naoyamd.github.io",
  "basePath": "/rotorbench",
  "launchUrl": "https://naoyamd.github.io/rotorbench/launch/integrated-robotic-handling-v3/",
  "launchJsonUrl": "https://naoyamd.github.io/rotorbench/framework/launches/integrated-robotic-handling-v3/launch.json",
  "promptUrl": "https://naoyamd.github.io/rotorbench/framework/launches/integrated-robotic-handling-v3/prompt.txt",
  "checks": {
    "redirectFree": true,
    "sameOrigin": true,
    "basePathMatched": true,
    "launchJsonExact": true,
    "promptExact": true,
    "pageMarkerMatched": true
  },
  "status": "verified",
  "verifiedAt": "2026-07-30T08:44:01.852Z"
}
